,title,source,year,month,day
287,直尚电竞完成千万Pre-A轮融资 电竞教育任重道远,中国新闻网,2017,07,21
288,上下游企业开始盈利 移动电竞产业逐渐成熟,中国经济网,2017,07,20
289,移动电竞产业逐渐成熟,经济日报,2017,07,20
290,移动电竞产业逐渐成熟,经济日报,2017,07,20
291,从电竞玩家到资本宠儿 雷蛇拟赴港上市“开玩”手游,上海证券报,2017,07,18
292,电竞巨头雷蛇将赴港IPO 联络互动持股5.01%,证券时报,2017,07,18
293,王者荣耀背后的电竞江湖:规模望达千亿 巨头纷纷涌入,中国经济周刊,2017,07,17
294,王者荣耀背后的电竞江湖,经济网,2017,07,17
295,全球电竞潮牌雷蛇赴港上市 计划进军中国手游市场,一财网,2017,07,15
296,移动电竞市场井喷式增长 2017年将全面超越端游,21世纪经济报道,2017,07,14
297,移动电竞年中盘点：产业链完善 步入井喷式增长,中国经济网,2017,07,13
298,暴雪打造NBA式电竞联赛 首个中国战队组建,第一财经日报,2017,07,13
299,[公司]郴电国际以1.59亿元竞得中水圣达1亿股股权,全景网,2017,07,11
300,暴雪打造NBA式电竞联赛 首个中国战队组建,第一财经日报,2017,07,13
301,[公司]郴电国际以1.59亿元竞得中水圣达1亿股股权,全景网,2017,07,11
302,电竞风口催生电竞教育 南京直尚电竞引领行业破局,中国新闻网,2017,07,10
303,成都的“电竞梦”：低房价、高工资打造“手游之都”,21世纪经济报道,2017,07,06
304,成都的电竞梦：低房价高工资打造手游之都,21世纪经济报道,2017,07,06
305,古中人：雷蛇上市利好电竞发展,新浪港股,2017,07,05
306,首批高校本科电竞专业招生,法治周末,2017,07,05
307,中国成最大电竞市场：人才缺口26万 需有效商业模式,第一财经日报,2017,07,04
308,国家体育总局再办电竞赛事 B5电竞馆成电竞校场,中国经济网,2017,07,03
309,WCA海外赛区陆续开赛 电竞国际生态圈建立,中国新闻网,2017,06,29
310,三四线的电竞小镇投资潮： 地方产业对接成难题,21世纪经济报道,2017,06,28
311,美媒称腾讯比肩任天堂 将共同引领全球电竞市场,新浪综合,2017,06,26
312,古中人：香港电竞热的最大得益者“柏能集团”,新浪港股,2017,06,26
313,WCA国际电竞学院火爆招生 开辟电竞新篇章,中国新闻网,2017,06,23
314,电竞行业：站在“风口”上，“钱”途在何方？,中国经济网,2017,06,22
315,腾讯近五亿元战略入股掌趣科技，意在整合布局电竞手游生态链,新华网,2017,06,21
316,腾讯正在攻入下一个蓝海 电竞五年内布局生态链,21世纪经济报道,2017,06,21
317,联盟电竞独家承办暴雪赛事,证券日报,2017,06,21
318,腾讯电竞发布新五年计划 开启中国电竞“黄金五年”,经济观察网,2017,06,20
319,"传媒行业:腾讯电竞五年规划,关注相关概念股",全景网,2017,06,20
320,"传媒行业:腾讯电竞五年规划,关注相关概念股",全景网,2017,06,20
321,被《王者荣耀》加持的腾讯电竞帝国如何带着上下游一起挣钱？,界面,2017,06,19
322,腾讯电竞推五年计划 拟打造千亿规模产业,证券时报,2017,06,19
323,全省首个电竞数娱小镇落户下城,新华网,2017,06,19
324,VSPN助力腾讯打造电竞王朝 共创“黄金五年”,中国新闻网,2017,06,18
325,半个电竞圈大佬都来了 看腾讯（00700）电竞黄金五年的“长跑打法”,智通财经网,2017,06,17
326,[互动]云图控股：云图电竞馆均可举办腾讯授权的合作赛事,全景网,2017,06,16
327,WCA国际电竞学院携手北开华嘉 开创竞教育新模式,中国新闻网,2017,06,16
328,京东游戏成立泛娱乐产业联盟 收购职业站队进军电竞产业,中国网,2017,06,15
329,2017 TGA夏季总决赛首周亮点回顾：“神奇女侠”打入电竞战队,中国新闻网,2017,06,14
330,电竞市场或破700亿，各方向处于怎样的投资阶段,中国新闻网,2017,06,14
331,电竞市场或将突破700亿，各细分方向处于怎样的投资阶段？,智通财经网,2017,06,13
332,电竞企业“超神互动”获投3亿元,北京商报,2017,06,12
333,湖南电竞网咖联赛进入第二阶段,新华网,2017,06,08
334,揭秘电竞培训班：思维反应要求高 50学员3人过关,新华网,2017,06,07
335,电竞战队常奥RW获千万元pre-A轮融资,北京商报,2017,06,06
336,CS:GO世界顶级赛事首次落户中国 电竞产业发展盛况空前,中国新闻网,2017,06,05
337,周 晨：中国电竞产业发展前景可期,中国经济网,2017,06,05
338,中国电竞产业发展前景可期,经济日报,2017,06,05
339,四川三所高校将开设电竞专业 培养主播教练等,新华网,2017,06,04
340,四川三所高校将开设电竞专业 培养主播教练等,新华网,2017,06,04
341,海信聘电竞天团为首席体验官 旨在提升专业画质,中国新闻网,2017,06,02
342,中国电竞产业市场规模持续增长 赛事经济如火如荼,新浪综合,2017,05,31
343,业内：体育产业大环境向好 电竞产业发展前景可期 ,经济参考报,2017,05,31
344,业内人士：中国电竞产业发展前景可期,中国证券网,2017,05,30
345,玩游戏不再是不务正业？电竞高手堪比战机飞行员，亚运会上将成为正式项目,第一财经网公众号,2017,05,26
346,电竞工委会筹备成立，宏图Brookstone等涉足布局,中国新闻网,2017,05,26
347,电竞市场登堂入室 4亿玩家引爆资本,第一财经日报,2017,05,26
348,海信赞助美国EG电竞战队 体育营销套餐再添“新品”,中国新闻网,2017,05,25
349,赞助电竞！海信体育营销“越玩越6,中国网,2017,05,25
350,电竞市场登堂入室 4亿玩家引爆资本,第一财经日报,2017,05,26
351,海信赞助美国EG电竞战队 体育营销套餐再添“新品”,中国新闻网,2017,05,25
352,赞助电竞！海信体育营销“越玩越6,中国网,2017,05,25
353,京东深度布局电竞生态 与LGD联手打造强IP文化,中国经济网,2017,05,24
354,德媒：中国电竞独领风骚 电游玩家成明星,新华社,2017,05,23
355,青年电竞大赛周日决战江城,新华网,2017,05,20
356,2亿《王者荣耀》玩家，拯救腾讯（00700）移动电竞梦,智通财经网,2017,05,19
357,金沙中国：非博彩业务占比将超6% 正研究电竞等新品种,智通财经网,2017,05,17
358,腾讯计划芜湖建立电竞小镇,北京商报,2017,05,17
359,雏鹰农牧：电竞基金会将结合泛娱乐跨领域投资合作,证券时报,2017,05,16
360,雏鹰农牧：电竞基金会将结合泛娱乐跨领域投资合作,证券时报,2017,05,16
361,罗技携手腾讯互娱深耕电竞市场,中国经济网,2017,05,16
362,李嘉诚和记电讯旗下“3集团“结盟Razer进军电竞,智通财经网,2017,05,15
363,热血电竞 WCA2017创新赛事缔造传奇,中国新闻网,2017,05,12
364,联盟电竞携手完美世界剑指中国电竞千亿市场,中国新闻网,2017,05,11
365,电竞主播第一梯队年收入过千万 大部分人基本无收入,三湘都市报,2017,05,08
366,世界大学生电子竞技联赛火热开赛，追逐你的电竞梦,中国新闻网,2017,05,02
367,Q1电竞报告：移动电竞首超PC 直播淡出投资热点,中国新闻网,2017,04,27
368,软岛科技2016年营收增长147%，电竞布局成主要增长点,中国新闻网,2017,04,26
369,华西村第三代孙喜耀：曾考虑在外单干 与王思聪电竞,新浪综合,2017,04,21
370,阿里体育将电竞推入亚奥赛事 2022年亮相亚运会,新浪综合,2017,04,20
371,多地抢滩电竞产业 重庆忠县拟投资40亿 打造“电竞小镇”,21世纪经济报道,2017,04,19
372,入选亚运会正式项目 电竞产业“风口”来了,上海证券报,2017,04,18
373,电竞进入2022年亚运会,北京商报,2017,04,18
374,电竞将成亚运会正式比赛项目 行业再迎春天？,每日经济新闻,2017,04,18
375,电竞成为2022年亚运会正式项目 这些上市公司已抢先入场,中国证券网,2017,04,17
376,亚奥理事会与阿里体育达成合作 电竞将进入杭州亚运会,中国新闻网,2017,04,17
377,电竞成为2022年杭州亚运会正式项目,证券时报网,2017,04,17
378,老牌电竞对战平台浩方 15周年发布会即将揭秘,新华网,2017,04,16
379,联盟电竞新馆开到拉斯维加斯,新华网,2017,04,15
380,联盟电竞新店落户拉斯维加斯,新华网,2017,04,14
381,以创新赛事铸就品牌护城河 WCA布局生态电竞星球,中国新闻网,2017,04,13
382,联盟电竞新馆落户拉斯维加斯明年初开业,证券日报,2017,04,13
383,忠县强力进军电竞产业力推集群化发展,重庆商报,2017,04,13
384,联盟电竞新馆落户拉斯维加斯全球电竞网络稳步推进,中国新闻网,2017,04,12
385,联盟电竞在美建立新电竞场馆 预计2018年初开业,中国网,2017,04,12
386,《CS：GO》归来，国服成撬动中国电竞格局支点,每日经济新闻,2017,04,12
387,中国数码文化再配股 引林俊杰代言电竞战队,智通财经网,2017,04,09
388,中国数码文化(08175)获授予电竞战队使用林俊杰肖像独家权利 涉及发行2265万股代价股,智通财经网,2017,04,07
389,电竞体系 升级之路,第一财经日报,2017,04,07
390,专业电竞人才缺口20万 WCA2017公布国际教育计划,中国新闻网,2017,03,28
391,WCA2017年度发布会：突破赛事边界 引领电竞生态,经济观察网,2017,03,24
392,FunPlus领投北美顶级电竞团队Cloud9 众多明星投资人跟投,经济观察网,2017,03,24
393,京东宣布组建电竞战队 进军泛娱乐领域,中国证券网,2017,03,22
394,电竞麻将无缘全运会,重庆商报,2017,03,21
395,阿里体育发布移动电竞战略 将建职业联盟体系,中国证券网,2017,03,14
396,移动电竞促游戏业持续增长 用户超2亿收入翻倍 ,中国新闻网,2017,03,02
397,《王者荣耀》年赚70亿 移动电竞或迎500亿增长空间,中国新闻网,2017,03,01
398,2017北京电子竞技公开赛3月启动报名 支持“电竞”青年创业,中国新闻网,2017,02,27
399,2016年国内电竞总产值达269亿元,北京商报,2017,02,23
400,2017北京电子竞技公开赛3月启动报名 支持“电竞”青年创业,中国新闻网,2017,02,27
401,2016年国内电竞总产值达269亿元,北京商报,2017,02,23
402,云图控股：农村电竞+理财高成长 买入评级,中证网,2017,02,18
403,NBA正式 杀入电竞领域,第一财经日报,2017,02,13
404,NBA正式杀入电竞领域,一财网,2017,02,12
405,联众(06899)架构新建 电竞自网游业务分离,智通财经网,2017,02,09
406,联络互动4亿认购中国数码文化可转债 共谋“移动电竞”,中国证券网,2017,02,09
407,电竞热遭遇人才短缺 英雄互娱联手高校开办专业,每日经济新闻,2017,01,19
408,瞄准年轻客群 国美进军电竞产业,北京商报,2017,01,18
409,建战队搞联赛 国美宣布进军电竞产业,中国新闻网,2017,01,18
410,建战队搞联赛 国美宣布进军电竞产业,中国新闻网,2017,01,18
411,行业营收来源比例“失调” 三大短板待解 联盟电竞欲打综合模式牌甩开对手,中国经济网,2017,01,18
412,中国数码文化寄望内容逐鹿电竞 行政总裁详解背后原因,证券日报,2017,01,18
413,电竞行业营收来源比例“失调” 三大短板待解,证券日报,2017,01,18
414,中国电竞市场引来资本窥伺,《小康》,2017,01,16
415,电竞年度盛典落幕,新华网,2017,01,13
416,WESG世界总决赛开赛 电竞领域首个反兴奋剂倡议面世,中国新闻网,2017,01,12
417,WESG电竞总决赛今开战,重庆商报,2017,01,12
418,2016中国电竞年度盛典盛大开幕开启电竞至高荣誉之门,经济观察网,2017,01,10
419,电竞黄金时代：从洪水猛兽到吸金产业,中国经济周刊,2017,01,09
420,电竞黄金时代：从洪水猛兽到吸金产业,中国经济周刊,2017,01,09
421,中国电竞市场去年规模达400亿,北京商报,2017,01,09
422,QQ将投入5亿资源支持“电竞梦想成就计划”,证券时报网,2017,01,06
423,UCG总决赛线上线下观看总人数爆发增长 高校电竞崛起,中国新闻网,2017,01,05
424,WECG全球电子竞技大赛:想要开启“全民电竞”时代,界面,2017,01,05
425,联络互动产业版图拼上内容板块影视、电竞、直播一个不落,证券日报,2017,01,05
426,电子巨头的转型求索：国内最大电竞馆落户“华强北”,经济观察网,2017,01,03
427,电竞市场蓄势待发：巨头加速培育市场 细分领域求发展,中国证券报-中证网,2016,12,31
428,2016中国电竞年度盛典奖项提名公布,经济观察网,2016,12,23
429,华强北市场转型瞄上电竞深赛格联手联盟电竞尝试电竞馆业务,证券日报,2016,12,22
430,华强北市场转型瞄上电竞深赛格联手联盟电竞尝试电竞馆业务,证券日报,2016,12,22
431,2016年十大电竞时刻,界面,2016,12,22
432,联盟电竞携手深赛格 电竞成传统电子市场转型催化剂,新浪港股,2016,12,21
433,萧泓：中国电竞需要人才和赛事,界面,2016,12,21
434,外媒电竞报告：2016年增长之后将在17年引来风暴,界面,2016,12,20
435,电竞市场六年增长10倍 腾讯之后又来了国家队,界面,2016,12,19
436,WCA倾力打造电竞生态圈 公司称未来方向一定是上市,证券日报,2016,12,19
437,银川深耕电竞产业,经济日报,2016,12,19
438,世界电竞大赛全球总决赛中国战队成大赢家,新华网,2016,12,18
439,丁东：电竞行业需对资本涌入有所鉴别,中国政府网,2016,12,18
440,丁东：电竞行业需对资本涌入有所鉴别,中国政府网,2016,12,18
441,电竞产业进入快车道 赛事接踵而至企业积极布局,中国证券报-中证网,2016,12,16
442,赛事接踵而至：电竞产业进入快车道 资本市场积极布局,中国证券报-中证网,2016,12,16
443,深圳赛格股份有限公司关于与天津联盟电竞互联网科技有限公司签署战略合作协议的公告,证券时报,2016,12,16
444,深赛格牵手联盟电竞打造深圳电竞馆项目,证券时报,2016,12,16
445,深赛格与天津联盟电竞战略合作,中证网,2016,12,15
446,深赛格与天津联盟电竞签署战略合作协议,中国证券网,2016,12,15
447,争议中的电竞：洪水猛兽还是新锐产业,新华网,2016,12,14
448,高溢价引资本涌入电竞行业,时代周报,2016,12,13
449,电竞难掩急功近利：市场年增速超30% 从业企业估值暴涨,北京商报,2016,12,12
450,“钛度科技”李晓峰：电竞冠军转型创业菜鸟,经济参考报,2016,12,09
451,腾讯电竞谋划独立 马化腾想做游戏界的英超联赛,界面,2016,12,08
452,网红频出资本猎逐 电竞业发展如何“健康成长”？,中国新闻网,2016,12,07
453,电竞业发展如何“健康成长”？,新华网,2016,12,07
454,网红频出 资本猎逐 电竞业发展如何“健康成长”？,新华网,2016,12,07
455,女子电竞战队CLG Red:从网吧到电竞,界面,2016,12,03
456,快讯：电竞概念股异动拉升 掌趣科技涨近9%,中国网,2016,11,29
457,台媒称大陆电竞产业带动直播风潮：有人一次赚几万,中国新闻网,2016,11,29
458,大陆电竞产业带动直播风潮：有人一次赚几万,新浪综合,2016,11,29
459,腾讯退出龙珠直播 PP TV巨资收购图谋“电竞＋直播 ”,中国经营报,2016,11,26
460,台媒称大陆电竞产业带动直播风潮：有人一次赚几万,中国新闻网,2016,11,29
461,大陆电竞产业带动直播风潮：有人一次赚几万,新浪综合,2016,11,29
462,腾讯退出龙珠直播 PP TV巨资收购图谋“电竞＋直播 ”,中国经营报,2016,11,26
463,兄弟惜英雄？影视霸主电竞新贵欲上演新三板世纪联姻,新浪财经,2016,11,25
464,华谊兄弟筹划百亿元重组 抢滩移动电竞风口,证券日报,2016,11,25
465,华谊兄弟二度牵手英雄互娱 发力移动电竞,证券时报,2016,11,25
466,华谊兄弟筹划百亿元重组 控股英雄互娱 抢滩“移动电竞”风口,证券日报,2016,11,25
467,游视拆分直播电竞业务 聚力传媒拟收购龙珠直播100%股权,中国网,2016,11,16
468,OKCoin币行比特币 区块链技术解决电竞行业失信问题,FX168,2016,11,11
469,南极电商超50%净利率存疑：阿里京东竞折腰,中国经济网,2016,10,26
470,南极电商超50%净利率存疑：阿里京东竞折腰,中国经济网,2016,10,26
471,CCGA颁奖盛典聚集电竞大咖,北京商报,2016,10,24
472,金利科技拟逾18亿收购微屏软件 布局电竞+VR,齐鲁晚报,2016,10,20
473,兰州电竞馆开馆：VR体验、网游产业热度攀升(图),中国新闻网,2016,10,08
474,阿里体育与巨人网络宣布达成移动电竞战略合作,新浪科技,2016,09,08
475,设立电竞专业，欠考虑还是“钱”考虑,北京商报,2016,09,08
476,万家文化的二次问询透露电竞行业秘密：主播分成差异大,界面,2016,09,06
477,还记得曾经的联众世界吗？ 如今进军体育电竞：不买战队，不养主播,证券时报网,2016,09,03
478,万家文化拟收购电竞企业 上交所二次询问标的公司详情,一财网,2016,09,01
479,S2总决赛将战 WCA构建电竞体育化生态圈,中国新闻网,2016,08,26
480,万家文化拟收购电竞企业 上交所二次询问标的公司详情,一财网,2016,09,01
481,S2总决赛将战 WCA构建电竞体育化生态圈,中国新闻网,2016,08,26
482,电竞产业狂飙突进 资本加速布局(股),证券时报网,2016,08,18
483,联盟电竞欧洲首发声：宣布成立分公司,新浪港股,2016,08,18
484,联盟电竞注资Esports Arena 联众出击北美意在全球,证券日报,2016,08,15
485,联众旗下联盟电竞注资北美电竞公司Esports Arena,中国证券网,2016,08,12
486,首届电竞奥运会将举行 上市公司积极入场,中国证券报-中证网,2016,08,12
487,万家文化并购重组：牵手明星赵薇进军电竞,新浪财经,2016,08,09
488,中国游戏直播市场规模将超2亿 电竞业尚处烧钱阶段,中国新闻网,2016,08,02
489,中国游戏直播市场规模将超2亿 电竞产业尚处于烧钱阶段,扬子晚报,2016,08,02
490,中国游戏直播市场规模将超2亿 电竞业尚处烧钱阶段,中国新闻网,2016,08,02
491,中国游戏直播市场规模将超2亿 电竞产业尚处于烧钱阶段,扬子晚报,2016,08,02
492,激活大众电竞市场的活力,经济日报,2016,08,01
493,英雄体育完成6.4亿元融资 成移动电竞市场的领先者 ,每日经济新闻,2016,07,29
494,国行版Xbox one S有望年底面市 发力影游联动、电竞、视频,一财网,2016,07,28
495,阿里体育欲洗牌电竞生态圈 将邀10000家网吧加盟电竞馆,中国新闻网,2016,07,27
496,与IeSF结盟，阿里体育构建电竞生态圈,国际金融报,2016,07,27
497,大众电竞亿万蓝海待挖掘 盛天网络“快乐电竞”抢先布局,证券时报网,2016,07,26
498,独家牵手IeSF 阿里体育构建电竞生态圈,证券时报网,2016,07,26
499,独家牵手IeSF 阿里体育构建电竞生态圈,中国证券网,2016,07,26
500,万家文化近8亿收购两电竞公司 加速“泛娱乐”产业布局,证券时报网,2016,07,22
501,万家文化拟7.8亿收购两公司 加速电竞领域布局,中国证券网,2016,07,22
502,电竞火爆的背后 泛娱乐+电子竞技如何布局高校市场？,一财网,2016,07,19
503,蓝游文化“创联赛-全球电竞嘉年华”概念全面升级,中国新闻网,2016,07,18
504,中国数码文化：把周杰伦签进电竞,中国经营报,2016,07,16
505,电竞调研S3：体育总局权威人士谈电竞,新浪港股,2016,07,13
506,明星跨界电竞 风口上电竞直播的新尝试,21世纪经济报道,2016,07,12
507,王思聪再出手 3000万投资蓝游文化布局高校电竞,一财网,2016,07,01
508,中国数码文化携手乐视体育点燃DOTA2电竞之夜,中证网,2016,06,26
509,"投资高校电竞市场，""投胎能手""王思聪进一步加码？",一财网,2016,06,23
510,电竞草根调研S2：第三方顶级赛事难盈利，巨头笼罩成行业阴影,综合,2016,06,21
511,电竞产业风口：有望撬动千亿市场 或将诞生奥运会,每日经济新闻,2016,06,21
512,云集将来跨界打造电竞内容平台 王思聪出任董事长,一财网,2016,06,17
513,王思聪抢占网红电竞直播三大风口 超越父亲只是时间问题,中国企业家,2016,06,13
514,全国大学生电竞联赛湖北赛区将在汉“开战”,荆楚网-楚天金报,2016,06,12
515,2016全国电竞公开赛12月举办 总奖金高达110万元,证券时报网,2016,06,03
516,中国数码文化就电竞直播订战略合作协议,大智慧阿思达克通讯社,2016,06,03
517,雷柏科技：传统业务向电竞外设转型 推荐评级,中证网,2016,06,01
518,雷柏科技:传统业务向电竞外设转型 无人机、机器人领域异军突起,中证网,2016,06,01
519,电竞线下调研S1:网咖与电竞互不匹配 产业仍需资本催熟 ,新浪港股,2016,05,27
520,“创新秀”试水渠道价值 电竞市场或赢新未来,中国新闻网,2016,05,25
521,乐视体育冠名WCA布局电竞市场,北京商报,2016,05,25
522,乐视体育冠名WCA进军电竞行业,21世纪经济报道,2016,05,21
523,资本抢滩电竞产业 乐视体育凑热闹布局电竞教育 ,新浪财经,2016,05,21
524,赛事同质化 电竞产业混战抢地盘,中国经营报,2016,05,21
525,新文化:布局电竞产业 泛娱乐布局持续多元化,中证网,2016,05,20
526,新文化投资5000万元布局电竞产业,证券时报网,2016,05,18
527,新文化：投资5000万元布局电竞产业,中证网,2016,05,18
528,利好叠加机构详解电竞版图 6只个股上涨空间有望超50%,证券日报,2016,05,17
529,电竞入门必学三招,北京商报,2016,05,17
530,体育总局筹办首届电竞嘉年华 概念股活跃,中国证券网,2016,05,16
531,体育总局筹办首届电竞嘉年华,上海证券报,2016,05,16
532,[路演]雷柏科技:电竞系列占国内过半销售额,全景网络,2016,05,11
533,雏鹰农牧:短期内电竞业务效益不会很明显,全景网络,2016,05,03
534,完美世界总裁张云帆： 电竞比赛正申请入奥，中国市场前景可观,21世纪经济报道,2016,04,27
535,研究报告：今年全球电竞产业营收将近5亿美元,证券时报网,2016,04,25
536,研究报告显示今年全球电竞产业营收将近5亿美元,中国证券网,2016,04,25
537,电竞业差距大：王思聪投的英雄互娱营收过亿 雨神电竞扭亏为盈,新浪财经,2016,04,23
538,1919＆酒仙网：酒类电商的竞合江湖,中国经营报,2016,04,23
539,发展电竞产业 雏鹰农牧挑战“猪周期”,证券时报,2016,04,20
540,雏鹰农牧集团股份有限公司关于投资设立电竞产业投资基金的进展公告,中国证券报-中证网,2016,04,19
541,国家级电竞大赛开幕 4股有望率先受益,证券时报,2016,04,18
542,国家级移动电竞大赛今日开战 政策红利助资本掘金80亿市场,每日经济新闻,2016,04,18
543,游戏概念股走强 移动电竞大赛成催化剂,证券时报,2016,04,14
544,全国移动电竞大赛下周一正式启动 概念股,新浪财经,2016,04,14
545,移动电竞体育正式“入场” 最好的时代来了吗？,东方网,2016,04,07
546,移动电竞体育正式“入场”,上海证券报,2016,04,07
547,博瑞传播拟参设项目公司涉足电竞行业,中国证券网,2016,04,06
548,雏鹰农牧：电竞布局有望加速 增持评级,中证网,2016,04,05
549,电竞 龙头应该在港股,综合,2016,04,05
550,雏鹰农牧：电竞布局有望加速 增持评级,中证网,2016,04,05
551,电竞 龙头应该在港股,综合,2016,04,05
552,[传闻求证]京东方A推电竞显示器？,全景网络,2016,04,05
553,机构看好7大行业 关注无人驾驶、电竞等,证券时报网,2016,03,31
554,启动首个原创赛事 阿里体育“热身”电竞产业,上海证券报,2016,03,31
555,启动首个原创赛事 阿里体育“热身”电竞产业,上海证券报,2016,03,31
556,二手车C2C电商融资竞速：“极品飞车”谁接盘？,21世纪经济报道,2016,03,30
557,雏鹰农牧牵手WE三大创始人 设电竞产业基金,每日经济新闻,2016,03,30
558,【一般推荐】通信宋嘉吉/王胜：迅游科技（300467）移动电竞与VR崛起，网游加速迎新起点——迅游科技公司更新报告,新浪财经,2016,03,29
559,雏鹰农牧一季度预计扭亏 斥资5亿参设电竞产业投资基金,证券时报网,2016,03,29
560,英雄互娱：坚持移动电竞商业化体育化运营,经济观察网,2016,03,29
561,复牌前日“高唱”电竞转型 金亚科技难掩投资者索赔声音,一财网,2016,03,29
562,国泰君安:移动电竞再掀青春热浪 市场非常广阔,全景网络,2016,03,29
563,【重点推荐】策略乔永远/戴康：移动电竞主题再掀青春热浪,新浪财经,2016,03,28
564,电竞行业加速发展 行业现蓝海机会(股),中国证券网,2016,03,28
565,传媒行业:总局推进移动电竞 继续看好VR内容,全景网络,2016,03,25
566,银川借力赛事发展电竞奥运经济,经济日报,2016,03,25
567,联众牵头成立“联盟电竞” 打响中国电竞全球攻略战,中国新闻网,2016,03,24
568,掌趣科技联手多家巨头打造“联盟电竞”,中国新闻网,2016,03,24
569,“联盟电竞”成立 体育化运作能“拯救”传统电竞？,一财网,2016,03,24
570,联众国际发起联盟电竞 将建十几个全球电竞馆,新浪科技,2016,03,24
571,官方首开移动电竞大赛，撬动百亿新风口,21世纪经济报道,2016,03,22
